{
  "schema": "testing-evidence-manifest.v1",
  "manifest_id": "manifest-schema-fixture",
  "canonicalization": "fkst-testing-evidence-manifest-canonical-json.v1",
  "canonical_sha256": "aaaaaaaaaaaaaaaaaaaaaaaaaaaaaaaaaaaaaaaaaaaaaaaaaaaaaaaaaaaaaaaa",
  "repository": {
    "id": "ChronoAIProject/fkst-packages-testing",
    "source_ref": {
      "kind": "git",
      "ref": "github.com/ChronoAIProject/fkst-packages-testing@0123456789abcdef0123456789abcdef01234567"
    },
    "source_sha256": "bbbbbbbbbbbbbbbbbbbbbbbbbbbbbbbbbbbbbbbbbbbbbbbbbbbbbbbbbbbbbbbb"
  },
  "run_id": "schema-run",
  "plan_ref": {
    "kind": "artifact",
    "ref": ".testing/runs/schema-run/test-plan.json"
  },
  "plan_sha256": "cccccccccccccccccccccccccccccccccccccccccccccccccccccccccccccccc",
  "entries": [
    {
      "evidence_id": "evidence-log",
      "case_id": "case-1",
      "assertion_id": "assertion-1",
      "role": "runner-log",
      "artifact_ref": {
        "kind": "artifact",
        "ref": ".testing/runs/schema-run/evidence/runner.log"
      },
      "sha256": "dddddddddddddddddddddddddddddddddddddddddddddddddddddddddddddddd",
      "media_type": "text/plain",
      "size_bytes": 128,
      "producer": "testing-runner",
      "producer_version": "1.0.0",
      "created_at": "0000-02-29T12:34:56Z",
      "sensitivity": "internal",
      "redaction_classification": "none",
      "policy_version": "evidence-policy-v1",
      "policy_status": "approved",
      "provenance": {
        "source_kind": "runner",
        "source_ref": "runner/execution",
        "source_sha256": "dddddddddddddddddddddddddddddddddddddddddddddddddddddddddddddddd"
      }
    },
    {
      "evidence_id": "evidence-screenshot",
      "case_id": "case-1",
      "role": "screenshot",
      "artifact_ref": {
        "kind": "artifact",
        "ref": ".testing/runs/schema-run/evidence/screenshot.png"
      },
      "sha256": "eeeeeeeeeeeeeeeeeeeeeeeeeeeeeeeeeeeeeeeeeeeeeeeeeeeeeeeeeeeeeeee",
      "media_type": "image/png",
      "size_bytes": 2048,
      "producer": "browser-runner",
      "producer_version": "1.0.0",
      "created_at": "0000-02-29T12:34:56Z",
      "sensitivity": "restricted",
      "redaction_classification": "none",
      "policy_version": "evidence-policy-v1",
      "policy_status": "withheld",
      "provenance": {
        "source_kind": "browser",
        "source_ref": "browser/execution",
        "source_sha256": "eeeeeeeeeeeeeeeeeeeeeeeeeeeeeeeeeeeeeeeeeeeeeeeeeeeeeeeeeeeeeeee"
      }
    },
    {
      "evidence_id": "evidence-sanitized-json",
      "case_id": "case-1",
      "assertion_id": "assertion-1",
      "role": "sanitized-json",
      "artifact_ref": {
        "kind": "artifact",
        "ref": ".testing/runs/schema-run/evidence/result.json"
      },
      "sha256": "ffffffffffffffffffffffffffffffffffffffffffffffffffffffffffffffff",
      "media_type": "application/json",
      "size_bytes": 512,
      "producer": "testing-runner",
      "producer_version": "1.0.0",
      "created_at": "0000-02-29T12:34:56Z",
      "sensitivity": "public",
      "redaction_classification": "sanitized",
      "policy_version": "evidence-policy-v1",
      "policy_status": "redacted",
      "provenance": {
        "source_kind": "runner",
        "source_ref": "runner/sanitized-result",
        "source_sha256": "ffffffffffffffffffffffffffffffffffffffffffffffffffffffffffffffff"
      }
    }
  ]
}
